{
  "$schema": "https://json-schema.org/draft/2020-12/schema",
  "$id": "https://poc-curves/contracts/events/envelope.schema.json",
  "title": "Envelope de Eventos da Plataforma de Curvas",
  "description": "Contrato do envelope comum a todos os eventos trafegados nos tópicos Kafka da plataforma de curvas financeiras. REGRA CRÍTICA DE PRECISÃO: Valores sujeitos a políticas de arredondamento de mercado financeiro (taxas, preços unitários, cotações, fatores de desconto, PU, spreads) trafegam SEMPRE como string numérica (vide tipo reutilizável DecimalString em $defs), NUNCA como number JSON. A representação IEEE-754 de ponto flutuante de 64 bits (double) nativa do JSON e de runtimes como JavaScript/V8 não sustenta precisão exata para taxas com 12 ou mais casas decimais, provocando erros de truncamento cumulativos inaceitáveis em cálculos financeiros.",
  "type": "object",
  "properties": {
    "eventId": {
      "type": "string",
      "format": "uuid",
      "description": "Identificador único universal do evento (UUIDv4). Utilizado para garantia de idempotência em todos os consumidores."
    },
    "correlationId": {
      "type": "string",
      "format": "uuid",
      "description": "Identificador de correlação herdado do run ou trigger que originou a cadeia de processamento. NUNCA deve ser gerado ou alterado por consumidores intermediários."
    },
    "source": {
      "type": "string",
      "enum": ["B3", "ANBIMA", "BCB", "BLOOMBERG", "LSEG", "MANUAL"],
      "description": "Origem da coleta ou emissão do dado de mercado / comando."
    },
    "dataset": {
      "type": "string",
      "minLength": 1,
      "description": "Identificador do conjunto de dados da fonte (ex.: 'BVBG.028', 'PR_DI1', 'TAXAS_SWAP')."
    },
    "referenceDate": {
      "type": "string",
      "format": "date",
      "description": "Data de referência de mercado/pregão no formato YYYY-MM-DD."
    },
    "producedAt": {
      "type": "string",
      "format": "date-time",
      "description": "Instante UTC em que o evento foi produzido e emitido, no formato ISO-8601 (RFC 3339)."
    },
    "schemaVersion": {
      "type": "string",
      "pattern": "^[0-9]+\\.[0-9]+$",
      "description": "Versão do schema do payload no formato major.minor (ex.: '1.0')."
    },
    "payloadKind": {
      "type": "string",
      "enum": ["INDIVIDUAL_QUOTES", "READY_CURVE"],
      "description": "Classificação da natureza do payload transportado: cotações/contratos individuais para bootstrapping ou curva pronta/importada."
    },
    "loteId": {
      "type": "string",
      "minLength": 1,
      "description": "Identificador determinístico do lote: UUIDv5 gerado a partir de source + dataset + referenceDate + sha256(conteúdo_adquirido_completo)."
    },
    "sequencia": {
      "type": "integer",
      "minimum": 1,
      "description": "Número sequencial ordinal do bloco dentro do lote (iniciando em 1)."
    },
    "totalBlocos": {
      "type": "integer",
      "minimum": 1,
      "description": "Quantidade total de blocos que compõem o lote completo."
    },
    "payload": {
      "type": "object",
      "description": "Objeto com os dados específicos do evento, em conformidade com o schema associado ao tópico e payloadKind."
    },
    "submittedBy": {
      "type": "string",
      "description": "Identificador do operador/usuário autor da carga manual. Campo obrigatório quando source for 'MANUAL'."
    },
    "justification": {
      "type": "string",
      "minLength": 1,
      "description": "Justificativa operacional e regulatória para a inserção ou reprocessamento manual. Campo obrigatório quando source for 'MANUAL'."
    }
  },
  "required": [
    "eventId",
    "correlationId",
    "source",
    "dataset",
    "referenceDate",
    "producedAt",
    "schemaVersion",
    "payloadKind",
    "loteId",
    "sequencia",
    "totalBlocos",
    "payload"
  ],
  "additionalProperties": false,
  "allOf": [
    {
      "if": {
        "properties": {
          "source": {
            "const": "MANUAL"
          }
        }
      },
      "then": {
        "required": ["submittedBy", "justification"]
      }
    }
  ],
  "$defs": {
    "DecimalString": {
      "type": "string",
      "pattern": "^-?[0-9]+([.,][0-9]+)?$",
      "description": "Tipo reutilizável para representação textual de grandezas numéricas do mercado financeiro (taxas de juros, preços unitários, spreads, cotações, fatores e limiares de consistência). O tráfego estrito como string numérica preserva a precisão decimal arbitrária necessária (ex.: taxas com 12+ casas decimais) sem contaminação por arredondamento binário de ponto flutuante."
    }
  }
}
